CompanyNumber,CompanyName,IncorporationDate,Status,Source,DateDownloaded,TimeDiscovered,SIC Codes,Category,SIC Description,Typical Use Case
16487345,URBAN EQUITY CONSULTANCY LTD,2025-06-01,active,,2025-06-01,2025-06-01T15:50:50.539149,"70229, 98000",Equity,,
16487289,KATTAH INVESTMENT GROUP LTD,2025-06-01,active,,2025-06-01,2025-06-01T15:50:50.539149,68100,Investments,,
16487158,CE JUBB INVESTMENTS LTD,2025-06-01,active,,2025-06-01,2025-06-01T15:50:50.539149,68100,Investments,,
16487244,PANOVUS GROUP LIMITED,2025-06-01,active,,2025-06-01,2025-06-01T15:50:50.539149,64209,Other,Activities of other holding companies n.e.c.,"Protected-cell SPVs, bespoke feeders."
16487181,VM CAPITAL LTD,2025-06-01,active,,2025-06-01,2025-06-01T15:50:50.539149,68209,Capital,,
